{
	"callType": "OneShot",
	"apiOptions": {
		"url": "https://api.mistral.ai/v1/chat/completions",
		"headers": {
			"Content-Type": "application/json",
			"Authorization": "Bearer token"
		},
		"model": "open-mistral-8x22b",
		"temperature": 0.1,
		"top_p": 1,
		"frequency_penalty": 1
	},
	"prompt": "router ping is not successfull",
	"context": "ETH_LINK_DOWN\r\nDescription\r\nThe network port connection is faulty. This alarm indicates that the Ethernet connection is incorrect and the port negotiation fails.\r\nAttribute\r\nAlarm ID\tAlarm Severity\tAlarm Type\r\n12793       Critical        Communications alarm\r\n\r\nParameters\r\nName\t        Meaning\r\nParameter 1     Indicates the chassis ID.\r\nParameter 2     Indicates the slot ID.\r\nParameter 3     Indicates the subcard ID.\r\nParameter 4     Indicates the port number.\r\nParameter 5     Indicates the port type.\r\nParameter 6     Indicates the port description.\r\nParameter 7     Indicates the interface type.\r\n                    0: UNI\r\n                    1: NNI\r\n                    2: FlexE interface\r\nImpact on the System\r\nCause 0:\r\n    The Ethernet ports on the local NE and remote NE work in different modes and fail to negotiate.\r\n    The link is faulty, the cable and optical fiber are incorrectly connected, or the remote device is faulty.\r\n    The working modes of the transmit and receive ports are inconsistent and the negotiation fails.\r\n\r\nCause 1: The transmission modes or the FEC modes of the connected ports are different.\r\n    The serveice maybe break.\r\n\r\nCause 2: When a router*s certified and non-certified 100GE 80 km optical modules are connected, the interconnection link fails due to different polarities.\r\n    The data transmission link fails.\r\n\r\nPossible Causes\r\nCause0:\r\n    The Ethernet ports on the local NE and remote NE work in different modes and fail to negotiate.\r\n    The link is faulty, the cable and optical fiber are incorrectly connected, or the remote device is faulty.\r\nCause1: The transmission modes or the FEC modes of the connected ports are different.\r\nCause2: When a router*s certified and non-certified 100GE 80 km optical modules are connected, the interconnection link fails due to different polarities.\r\n\r\nProcedure\r\nCause0:\r\n    The Ethernet ports on the local NE and remote NE work in different modes and fail to negotiate.\r\n        (1) On the NMS, check whether the Ethernet ports at both ends work in the same mode.\r\n        (2) If not, modify the configuration so that they work in the same mode. Then, check whether the alarm is cleared.\r\n\r\n    The link is faulty, the cable and optical fiber are incorrectly connected, or the remote device is faulty.\r\n        (1) Check whether the cable or optical fiber is faulty. If so, rectify the fault and check whether the alarm is cleared.\r\n        (2) If the alarm persists, check whether the remote device is faulty. Replace the board of the remote device and check whether the alarm is cleared.\r\n        (3) If the alarm persists, replace the board that reports the alarm and check whether the working mode of the optical port on the local device is the same as that of the optical port on the remote device. If the board is replaced and the working modes of the optical ports on the local and remote devices are the same, the alarm is automatically cleared.\r\n\r\nCause1: The transmission modes or the FEC modes of the connected ports are different.\r\n    Check whether the transmission modes or the FEC modes of the connected ports are the same. If not, locate the cause of the difference to make the transmission modes or the FEC modes of the connected ports be the same.\r\n\r\nCause2: When a router*s certified and non-certified 100GE 80 km optical modules are connected, the interconnection link fails due to different polarities.\r\n    On the NMS, enable SerDes polarity inversion for the 100GE or FlexE-100G interface.\r\n\r\nAlarm Correlation\r\nThe following alarms suppress the reporting of the current alarm: LSR_NO_FITED, ETH_LOS, LASER_MOD_ERR, LOOP_ALM\r\n"
}